id,externalId,skipped,status,label,content
ckyd73qb803dw0lyq7ezy7yk9,428,False,LABELED,SUBSCRIPTION,"really enjoyed this app, a great way to follow and discover interesting articles. unfortunately after about a day of browsing it told me that i had read all of the free stories that i was entitled to for the month and if i wanted to keep reading i needed to pay a monthly subscription fee"
ckyd73qb903ef0lyq9sos8d3h,447,False,LABELED,INTERFACE,"latest update forces me to link twitter, and there's no way to refuse. do i need to make a twitter account to use the app i paid for?"
ckyd73qba03ew0lyq1sp0doqr,464,False,LABELED,CONTENT,excellent material and blogs
ckyd73qba03f00lyq14ed816c,468,False,LABELED,CONTENT,informative and short reads that are easy for the eyes.
ckyd73qba03f40lyq3151hswr,472,False,LABELED,INTERFACE,it's pretty good design and functionality 
ckyd73qbb03fn0lyqgumed7pu,491,False,LABELED,CONTENT,"some very good content but plagued with click bait articles, not worth sorting through the junk."
ckyd73uif042n0mw82wpudw4t,509,False,LABELED,CONTENT,"uninstalled the second i saw the ""6 designs that white people never notice are racist"" article. anybody that publishes that trash, i want no part of... ready for a few of the ""racist"" products? sunglasses, bandaids, heart monitors, make up... so cringe. aa's make up about 10% of the us population - why the hell would any biz make a product for such a small segment??? great way to make sure you fail as a biz but this article tried to make smart common sense biz practices into a race issue. trash."
ckyd73uif042q0mw80e9w6gw2,512,False,LABELED,CONTENT,what is there not to like here ? the quality of the blogs are amazing.
ckyd73uif042t0mw864e1gkbc,515,False,LABELED,SUBSCRIPTION,"it seems like im paying to something that i can easily find on the internet.. uninstalling now,, id rather create my own free platform"
ckyd73uif042x0mw80whianxw,519,False,LABELED,CONTENT,it's a good app to motivate reading for beginners as it give us a variety of field. i can read which ever topic i want.
ckyd73uif042z0mw815xq7zbo,521,False,LABELED,CONTENT,i enjoy the breadth of articles.
ckyd73uif04340mw8cqg669gc,526,False,LABELED,CONTENT,lovely way of quickly catching up with news of your favourite projects
ckyd73uif04360mw82jalfvbc,528,False,LABELED,SUBSCRIPTION,really like the content/topics but didn't realize there was a limit to reading and forcing into a membership..that's reverse marketing.
ckyd73uig043p0mw82r0c1vfv,547,False,LABELED,CONTENT,good and short insightful stories and editorials.
ckyd73uih043u0mw806icfwkd,552,False,LABELED,USER_EXPERIENCE,it's not that convenient for beginners.
ckyd73uih043y0mw8h6n8140h,556,False,LABELED,CONTENT,great stuff to read.
ckyd73uih04400mw85nsg3g7i,558,False,LABELED,INTERFACE,nice app easy to handle
ckyd73uih044a0mw8dww2aypt,568,False,LABELED,USER_EXPERIENCE,very nice app
ckyd73uih044b0mw8fhi1bnig,569,False,LABELED,CONTENT,good articles about a broad range of interesting topics.
ckyd73uii044e0mw8hk7c34t5,572,False,LABELED,CONTENT,that srticle i read here was excellent!
ckyd73uii044f0mw81i84eypy,573,False,LABELED,SUBSCRIPTION,nice blogging platform but no free option.
ckyd73uii044i0mw8e0xwhum2,576,False,LABELED,CONTENT,informative
ckyd73uii044j0mw89wbjdkmu,577,False,LABELED,USER_EXPERIENCE,nice app for the writter
ckyd73uii044k0mw8emn3but0,578,False,LABELED,INTERFACE,"i like the way it helps me bookmarks, highlights, and saving articles as i read. it also separately shows my highlights."
ckyd73uii044l0mw84eju7yfc,579,False,LABELED,CONTENT,"medium has some great, life-changing articles."
ckyd73uii044n0mw89r8j12vu,581,False,LABELED,INTERFACE,"not all functionalities of the desktop version are available in the app (e.g. private messaging), but it works very well for reading."
ckyd73uii044o0mw8b2n0fug0,582,False,LABELED,CONTENT,great advice on love relationships for men are women
ckyd73uii044q0mw82njm57ww,584,False,LABELED,CONTENT,good articles! thank you for writing on such topics.
ckyd73uii044r0mw80csqc8ps,585,False,LABELED,CONTENT,great app for informative article
ckyd73uii044t0mw8cr2u4sjy,587,False,LABELED,INTERFACE,"all in all great app. bug free and relevant suggestions for reading. but i am unable to save articles for further use. somehow clicking the ""add to library"" doesn't work for me"
ckyd73uij044w0mw85fnm6zw3,590,False,LABELED,INTERFACE,not sure how to comment yet via the app vs laptop but easily navigable otherwise.
ckyd73uij044z0mw8082a9agc,593,False,LABELED,INTERFACE,"slow as slowpoke, even on a 4gb ram mid range smart phone, it a shame on a big company like medium, no mobile responsiveness."
ckyd73zb70goy0l0ehtpsaxmx,600,False,LABELED,CONTENT,i'm enjoying the other writers thus far.
ckyd73zb70gp00l0e3ltadtfo,602,False,LABELED,CONTENT,great app for interesting reads!
ckyd73zb80gp70l0edouggarz,609,False,LABELED,INTERFACE,worked fine for a hour then makes me sign in every minute. and interupts while your trying to read even paid to become member
ckyd73zb80gpa0l0ehm17c2w7,612,False,LABELED,INTERFACE,forces you to join twitter or can't sign up
ckyd73zb80gpd0l0e2bsebk02,615,False,LABELED,INTERFACE,it's the worst application ever. it doesn't work for once. and i can't sign out of it. i do not advise anyone to download this thing who keeps sending messages and suspicious things.!
ckyd73zb80gpf0l0e0w9ye1iu,617,False,LABELED,CONTENT,very informative and better learning platform
ckyd73zb80gpg0l0egaar38ei,618,False,LABELED,INTERFACE,it will be more fascinating if there is dark mode?
ckyd73zb80gpi0l0e9ap229g4,620,False,LABELED,SUBSCRIPTION,"its like if you went to the news chanal and they asked you for money just to watch, you need a membership"
ckyd73zb90gps0l0eff4q0hvb,630,False,LABELED,INTERFACE,"dark mode is great and i only like to use darkmode. however the text is in grey color instead of white, pretty hard to read in daytime . layout is not really utilising the space: text too small and too much padding around the text."
ckyd73zb90gpx0l0eblpy72wv,635,False,LABELED,INTERFACE,when ever i try to click on follow option it never works ....and this is so frustrating
ckyd73zb90gpz0l0edz8e72k4,637,False,LABELED,USER_EXPERIENCE,community is kinda dead.
ckyd73zb90gq20l0eb55ag4ag,640,False,LABELED,INTERFACE,"old ui was better, now i don't like the app to use because of the new ui"
ckyd73zba0gq40l0ec2fzhcv8,642,False,LABELED,INTERFACE,you will not find bookmark categories. if you bookmark from website into some newly created category. you will not find that in app.
ckyd73zba0gq90l0egjde3fan,647,False,LABELED,INTERFACE,"medium is a great example of how a great thing ruins itself , it was a great platform but it's algorithm ruined everything. remember the best writing on medium won't make it to your feed , you have to search for it & that's sad"
ckyd73zba0gqa0l0e67h90ivx,648,False,LABELED,CONTENT,a very good app to read posts generated by really amazing writers.
